{
  "campaign_id": "CMP-SIM-BOPET-NEW-GRADE-A",
  "product_grade": "BOPET_NEW_GRADE_A",
  "user_objective": {
    "performance_goal": "获得厚度均匀、双折射稳定、可进入真实产线 shadow validation 的新产品配方",
    "priority_order": ["birefringence_cv", "thickness_cv", "birefringence_mean", "thickness_mean"],
    "business_context": "研发希望在有限废料和有限试验次数内收敛到最优候选 recipe",
    "release_expectation": "online candidate with offline validation required"
  },
  "targets": {
    "thickness_mean": { "target": 12.0, "tolerance": 0.25 },
    "thickness_cv": { "max": 1.8 },
    "birefringence_mean": { "target": 0.082, "tolerance": 0.012 },
    "birefringence_cv": { "max": 3.5 }
  },
  "constraints": {
    "max_waste_meter": 800,
    "max_iterations": 12,
    "manual_approval_required": false
  }
}
